"";"query";"significant";"p_value";"term_size";"query_size";"intersection_size";"precision";"recall";"term_id";"source";"term_name";"effective_domain_size";"source_order";"set"
"1";"query_1";TRUE;2,1737421083243e-09;1655;39;20;0,512820512820513;0,0120845921450151;"GO:1901700";"GO:BP";"response to oxygen-containing compound";21092;24953;"Up"
"2";"query_1";TRUE;7,45494027177742e-08;3034;59;30;0,508474576271186;0,00988793671720501;"GO:0010033";"GO:BP";"response to organic substance";21092;4303;"Up"
"3";"query_1";TRUE;1,91951403664068e-07;1186;39;16;0,41025641025641;0,0134907251264755;"GO:1901701";"GO:BP";"cellular response to oxygen-containing compound";21092;24954;"Up"
"4";"query_1";TRUE;4,62712956698524e-07;2405;59;26;0,440677966101695;0,0108108108108108;"GO:0071310";"GO:BP";"cellular response to organic substance";21092;19316;"Up"
"5";"query_1";TRUE;5,20921750805222e-07;2814;39;22;0,564102564102564;0,007818052594172;"GO:0009605";"GO:BP";"response to external stimulus";21092;3973;"Up"
"6";"query_1";TRUE;2,88715056725184e-06;3049;59;28;0,474576271186441;0,00918333879960643;"GO:0070887";"GO:BP";"cellular response to chemical stimulus";21092;19091;"Up"
"7";"query_1";TRUE;4,91590742623054e-06;4383;48;29;0,604166666666667;0,00661647273556924;"GO:0042221";"GO:BP";"response to chemical";21092;11605;"Up"
"8";"query_1";TRUE;8,91876511278687e-06;786;61;15;0,245901639344262;0,0190839694656489;"GO:0006954";"GO:BP";"inflammatory response";21092;2883;"Up"
"9";"query_1";TRUE;9,86160324846041e-06;1592;59;20;0,338983050847458;0,0125628140703518;"GO:0009719";"GO:BP";"response to endogenous stimulus";21092;4063;"Up"
"10";"query_1";TRUE;1,59965553310587e-05;3938;40;24;0,6;0,00609446419502285;"GO:0006950";"GO:BP";"response to stress";21092;2880;"Up"
"11";"query_1";TRUE;1,67532212448533e-05;909;34;12;0,352941176470588;0,0132013201320132;"GO:0033993";"GO:BP";"response to lipid";21092;9622;"Up"
"12";"query_1";TRUE;2,10765917802831e-05;1348;71;20;0,28169014084507;0,0148367952522255;"GO:0071495";"GO:BP";"cellular response to endogenous stimulus";21092;19491;"Up"
"13";"query_1";TRUE;3,00968484174519e-05;619;71;14;0,197183098591549;0,0226171243941842;"GO:0007169";"GO:BP";"transmembrane receptor protein tyrosine kinase signaling pathway";21092;3065;"Up"
"14";"query_1";TRUE;3,46237600020872e-05;9000;44;37;0,840909090909091;0,00411111111111111;"GO:0050896";"GO:BP";"response to stimulus";21092;15390;"Up"
"15";"query_1";TRUE;4,05354887261687e-05;595;34;10;0,294117647058824;0,0168067226890756;"GO:0071396";"GO:BP";"cellular response to lipid";21092;19400;"Up"
"16";"query_1";TRUE;5,0887431034399e-05;1604;58;19;0,327586206896552;0,0118453865336658;"GO:0048585";"GO:BP";"negative regulation of response to stimulus";21092;14877;"Up"
"17";"query_1";TRUE;5,2053906006738e-05;2627;35;18;0,514285714285714;0,00685192234488009;"GO:0035556";"GO:BP";"intracellular signal transduction";21092;10450;"Up"
"18";"query_1";TRUE;0,000143296751117683;324;37;8;0,216216216216216;0,0246913580246914;"GO:0071496";"GO:BP";"cellular response to external stimulus";21092;19492;"Up"
"19";"query_1";TRUE;0,00014473869869801;1352;58;17;0,293103448275862;0,0125739644970414;"GO:0010648";"GO:BP";"negative regulation of cell communication";21092;4789;"Up"
"20";"query_1";TRUE;0,000152683745960898;1357;58;17;0,293103448275862;0,0125276344878408;"GO:0023057";"GO:BP";"negative regulation of signaling";21092;7648;"Up"
"21";"query_1";TRUE;0,000182087681342635;473;37;9;0,243243243243243;0,0190274841437632;"GO:0031667";"GO:BP";"response to nutrient levels";21092;8423;"Up"
"22";"query_1";TRUE;0,000208109842126107;319;54;9;0,166666666666667;0,0282131661442006;"GO:0001933";"GO:BP";"negative regulation of protein phosphorylation";21092;661;"Up"
"23";"query_1";TRUE;0,000209504298765191;224;37;7;0,189189189189189;0,03125;"GO:0031669";"GO:BP";"cellular response to nutrient levels";21092;8425;"Up"
"24";"query_1";TRUE;0,00021900911910319;976;71;16;0,225352112676056;0,0163934426229508;"GO:0007167";"GO:BP";"enzyme-linked receptor protein signaling pathway";21092;3063;"Up"
"25";"query_1";TRUE;0,000311977824387138;504;37;9;0,243243243243243;0,0178571428571429;"GO:0009991";"GO:BP";"response to extracellular stimulus";21092;4273;"Up"
"26";"query_1";TRUE;0,000475526152897785;2;11;2;0,181818181818182;1;"GO:1990785";"GO:BP";"response to water-immersion restraint stress";21092;29100;"Up"
"27";"query_1";TRUE;0,000485689622507355;162;35;6;0,171428571428571;0,037037037037037;"GO:0032640";"GO:BP";"tumor necrosis factor production";21092;8876;"Up"
"28";"query_1";TRUE;0,000485689622507355;162;35;6;0,171428571428571;0,037037037037037;"GO:0032680";"GO:BP";"regulation of tumor necrosis factor production";21092;8916;"Up"
"29";"query_1";TRUE;0,000505153532790928;255;37;7;0,189189189189189;0,0274509803921569;"GO:0031668";"GO:BP";"cellular response to extracellular stimulus";21092;8424;"Up"
"30";"query_1";TRUE;0,000571975880925272;595;34;9;0,264705882352941;0,0151260504201681;"GO:0032870";"GO:BP";"cellular response to hormone stimulus";21092;9063;"Up"
"31";"query_1";TRUE;0,000581073556193208;167;35;6;0,171428571428571;0,0359281437125748;"GO:1903555";"GO:BP";"regulation of tumor necrosis factor superfamily cytokine production";21092;26592;"Up"
"32";"query_1";TRUE;0,000581073556193208;167;35;6;0,171428571428571;0,0359281437125748;"GO:0071706";"GO:BP";"tumor necrosis factor superfamily cytokine production";21092;19660;"Up"
"33";"query_1";TRUE;0,00059184269233025;361;54;9;0,166666666666667;0,0249307479224377;"GO:0042326";"GO:BP";"negative regulation of phosphorylation";21092;11653;"Up"
"34";"query_1";TRUE;0,000644482560875727;673;71;13;0,183098591549296;0,0193164933135215;"GO:0071363";"GO:BP";"cellular response to growth factor stimulus";21092;19367;"Up"
"35";"query_1";TRUE;0,000718002100020274;267;54;8;0,148148148148148;0,0299625468164794;"GO:0051348";"GO:BP";"negative regulation of transferase activity";21092;15768;"Up"
"36";"query_1";TRUE;0,000730752847735289;56;23;4;0,173913043478261;0,0714285714285714;"GO:0071385";"GO:BP";"cellular response to glucocorticoid stimulus";21092;19389;"Up"
"37";"query_1";TRUE;0,000908109635070497;4749;59;31;0,525423728813559;0,00652769004000842;"GO:0048523";"GO:BP";"negative regulation of cellular process";21092;14825;"Up"
"38";"query_1";TRUE;0,00103904761087669;702;71;13;0,183098591549296;0,0185185185185185;"GO:0070848";"GO:BP";"response to growth factor";21092;19072;"Up"
"39";"query_1";TRUE;0,00111164962707412;1138;39;12;0,307692307692308;0,0105448154657293;"GO:0009628";"GO:BP";"response to abiotic stimulus";21092;3992;"Up"
"40";"query_1";TRUE;0,00116809975227771;1988;33;14;0,424242424242424;0,00704225352112676;"GO:0008283";"GO:BP";"cell population proliferation";21092;3563;"Up"
"41";"query_1";TRUE;0,00120736872587528;857;34;10;0,294117647058824;0,0116686114352392;"GO:0009725";"GO:BP";"response to hormone";21092;4069;"Up"
"42";"query_1";TRUE;0,00122486380940006;1683;33;13;0,393939393939394;0,0077243018419489;"GO:0042127";"GO:BP";"regulation of cell population proliferation";21092;11533;"Up"
"43";"query_1";TRUE;0,00126907223250241;101;35;5;0,142857142857143;0,0495049504950495;"GO:0032760";"GO:BP";"positive regulation of tumor necrosis factor production";21092;8996;"Up"
"44";"query_1";TRUE;0,00133830762316625;65;23;4;0,173913043478261;0,0615384615384615;"GO:0071384";"GO:BP";"cellular response to corticosteroid stimulus";21092;19388;"Up"
"45";"query_1";TRUE;0,00148572232586892;1934;39;15;0,384615384615385;0,0077559462254395;"GO:0033554";"GO:BP";"cellular response to stress";21092;9509;"Up"
"46";"query_1";TRUE;0,00153975413374646;105;35;5;0,142857142857143;0,0476190476190476;"GO:1903557";"GO:BP";"positive regulation of tumor necrosis factor superfamily cytokine production";21092;26594;"Up"
"47";"query_1";TRUE;0,00155765472418299;145;47;6;0,127659574468085;0,0413793103448276;"GO:0050729";"GO:BP";"positive regulation of inflammatory response";21092;15260;"Up"
"48";"query_1";TRUE;0,00171034589902481;205;54;7;0,12962962962963;0,0341463414634146;"GO:0006469";"GO:BP";"negative regulation of protein kinase activity";21092;2443;"Up"
"49";"query_1";TRUE;0,00171319202715875;1243;58;15;0,258620689655172;0,0120675784392599;"GO:0009968";"GO:BP";"negative regulation of signal transduction";21092;4264;"Up"
"50";"query_1";TRUE;0,00172779606094235;246;29;6;0,206896551724138;0,024390243902439;"GO:0071216";"GO:BP";"cellular response to biotic stimulus";21092;19226;"Up"
"51";"query_1";TRUE;0,00187727077210128;120;32;5;0,15625;0,0416666666666667;"GO:0002224";"GO:BP";"toll-like receptor signaling pathway";21092;879;"Up"
"52";"query_1";TRUE;0,00197064253039016;417;54;9;0,166666666666667;0,0215827338129496;"GO:0045936";"GO:BP";"negative regulation of phosphate metabolic process";21092;13624;"Up"
"53";"query_1";TRUE;0,00201010235754866;418;54;9;0,166666666666667;0,0215311004784689;"GO:0010563";"GO:BP";"negative regulation of phosphorus metabolic process";21092;4710;"Up"
"54";"query_1";TRUE;0,00205122069165236;105;37;5;0,135135135135135;0,0476190476190476;"GO:1901655";"GO:BP";"cellular response to ketone";21092;24918;"Up"
"55";"query_1";TRUE;0,00210159738316628;6309;62;37;0,596774193548387;0,00586463781898875;"GO:0048518";"GO:BP";"positive regulation of biological process";21092;14820;"Up"
"56";"query_1";TRUE;0,00225473801803791;360;47;8;0,170212765957447;0,0222222222222222;"GO:0050727";"GO:BP";"regulation of inflammatory response";21092;15258;"Up"
"57";"query_1";TRUE;0,00240932887006048;5706;60;34;0,566666666666667;0,00595864002804066;"GO:0051171";"GO:BP";"regulation of nitrogen compound metabolic process";21092;15620;"Up"
"58";"query_1";TRUE;0,00241880998824987;1028;31;10;0,32258064516129;0,00972762645914397;"GO:0010243";"GO:BP";"response to organonitrogen compound";21092;4492;"Up"
"59";"query_1";TRUE;0,00242002943187673;515;58;10;0,172413793103448;0,0194174757281553;"GO:1902532";"GO:BP";"negative regulation of intracellular signal transduction";21092;25699;"Up"
"60";"query_1";TRUE;0,00249974724696596;760;32;9;0,28125;0,0118421052631579;"GO:0009617";"GO:BP";"response to bacterium";21092;3984;"Up"
"61";"query_1";TRUE;0,0028028050056727;206;37;6;0,162162162162162;0,029126213592233;"GO:1901654";"GO:BP";"response to ketone";21092;24917;"Up"
"62";"query_1";TRUE;0,00292475150478437;4088;60;28;0,466666666666667;0,00684931506849315;"GO:0019219";"GO:BP";"regulation of nucleobase-containing compound metabolic process";21092;6467;"Up"
"63";"query_1";TRUE;0,00341516994065192;5494;60;33;0,55;0,00600655260283946;"GO:0010468";"GO:BP";"regulation of gene expression";21092;4645;"Up"
"64";"query_1";TRUE;0,00347848513702488;228;54;7;0,12962962962963;0,0307017543859649;"GO:0033673";"GO:BP";"negative regulation of kinase activity";21092;9592;"Up"
"65";"query_1";TRUE;0,00351819332546033;5918;59;34;0,576271186440678;0,00574518418384589;"GO:0048519";"GO:BP";"negative regulation of biological process";21092;14821;"Up"
"66";"query_1";TRUE;0,00483947670676297;5869;60;34;0,566666666666667;0,00579315045152496;"GO:0080090";"GO:BP";"regulation of primary metabolic process";21092;20830;"Up"
"67";"query_1";TRUE;0,00500373870596872;5641;62;34;0,548387096774194;0,00602730012409147;"GO:0048522";"GO:BP";"positive regulation of cellular process";21092;14824;"Up"
"68";"query_1";TRUE;0,00507311372158889;1356;58;15;0,258620689655172;0,0110619469026549;"GO:0080134";"GO:BP";"regulation of response to stress";21092;20849;"Up"
"69";"query_1";TRUE;0,00512100858862386;1117;31;10;0,32258064516129;0,00895255147717099;"GO:1901698";"GO:BP";"response to nitrogen compound";21092;24951;"Up"
"70";"query_1";TRUE;0,00538053872623627;7463;62;40;0,645161290322581;0,00535977488945464;"GO:0032501";"GO:BP";"multicellular organismal process";21092;8794;"Up"
"71";"query_1";TRUE;0,00541370963545001;3951;60;27;0,45;0,00683371298405467;"GO:0010556";"GO:BP";"regulation of macromolecule biosynthetic process";21092;4703;"Up"
"72";"query_1";TRUE;0,00563616862035006;2392;58;20;0,344827586206897;0,00836120401337793;"GO:0051172";"GO:BP";"negative regulation of nitrogen compound metabolic process";21092;15621;"Up"
"73";"query_1";TRUE;0,00567024935031947;762;54;11;0,203703703703704;0,0144356955380577;"GO:0043086";"GO:BP";"negative regulation of catalytic activity";21092;12113;"Up"
"74";"query_1";TRUE;0,00596687794774794;6842;60;37;0,616666666666667;0,00540777550423853;"GO:0060255";"GO:BP";"regulation of macromolecule metabolic process";21092;17011;"Up"
"75";"query_1";TRUE;0,00601387083456096;92;52;5;0,0961538461538462;0,0543478260869565;"GO:0045638";"GO:BP";"negative regulation of myeloid cell differentiation";21092;13350;"Up"
"76";"query_1";TRUE;0,00724497514764424;68;33;4;0,121212121212121;0,0588235294117647;"GO:2000379";"GO:BP";"positive regulation of reactive oxygen species metabolic process";21092;29581;"Up"
"77";"query_1";TRUE;0,00796622206208355;1554;35;12;0,342857142857143;0,00772200772200772;"GO:0009607";"GO:BP";"response to biotic stimulus";21092;3975;"Up"
"78";"query_1";TRUE;0,00843942525435544;498;54;9;0,166666666666667;0,0180722891566265;"GO:0031400";"GO:BP";"negative regulation of protein modification process";21092;8292;"Up"
"79";"query_1";TRUE;0,00849556155511074;3970;71;30;0,422535211267606;0,00755667506297229;"GO:0048583";"GO:BP";"regulation of response to stimulus";21092;14875;"Up"
"80";"query_1";TRUE;0,00850344810684962;489;30;7;0,233333333333333;0,0143149284253579;"GO:1901652";"GO:BP";"response to peptide";21092;24915;"Up"
"81";"query_1";TRUE;0,0086193183131173;3535;60;25;0,416666666666667;0,00707213578500707;"GO:0010604";"GO:BP";"positive regulation of macromolecule metabolic process";21092;4746;"Up"
"82";"query_1";TRUE;0,00905086689846065;6551;41;27;0,658536585365854;0,00412150816669211;"GO:0007154";"GO:BP";"cell communication";21092;3050;"Up"
"83";"query_1";TRUE;0,00921043876290412;1039;35;10;0,285714285714286;0,00962463907603465;"GO:0051248";"GO:BP";"negative regulation of protein metabolic process";21092;15683;"Up"
"84";"query_1";TRUE;0,0097976308626221;1111;56;13;0,232142857142857;0,0117011701170117;"GO:0044092";"GO:BP";"negative regulation of molecular function";21092;12615;"Up"
"85";"query_1";TRUE;0,00995353461359716;113;47;5;0,106382978723404;0,0442477876106195;"GO:0071901";"GO:BP";"negative regulation of protein serine/threonine kinase activity";21092;19774;"Up"
"86";"query_1";TRUE;0,0104313532667819;2567;35;15;0,428571428571429;0,00584339696143358;"GO:0051246";"GO:BP";"regulation of protein metabolic process";21092;15681;"Up"
"87";"query_1";TRUE;0,011003998074702;1742;61;17;0,278688524590164;0,00975889781859931;"GO:0006952";"GO:BP";"defense response";21092;2881;"Up"
"88";"query_1";TRUE;0,0120195633956329;4114;60;27;0,45;0,00656295576081672;"GO:0031326";"GO:BP";"regulation of cellular biosynthetic process";21092;8252;"Up"
"89";"query_1";TRUE;0,0120820494124015;24;32;3;0,09375;0,125;"GO:0060907";"GO:BP";"positive regulation of macrophage cytokine production";21092;17638;"Up"
"90";"query_1";TRUE;0,0131211256760907;124;7;3;0,428571428571429;0,0241935483870968;"GO:0042542";"GO:BP";"response to hydrogen peroxide";21092;11797;"Up"
"91";"query_1";TRUE;0,013314732281138;2;56;2;0,0357142857142857;1;"GO:0071881";"GO:BP";"adenylate cyclase-inhibiting adrenergic receptor signaling pathway";21092;19759;"Up"
"92";"query_1";TRUE;0,0133247480782431;210;47;6;0,127659574468085;0,0285714285714286;"GO:0071222";"GO:BP";"cellular response to lipopolysaccharide";21092;19232;"Up"
"93";"query_1";TRUE;0,0133472617957034;169;58;6;0,103448275862069;0,0355029585798817;"GO:0043409";"GO:BP";"negative regulation of MAPK cascade";21092;12282;"Up"
"94";"query_1";TRUE;0,014339442906047;327;47;7;0,148936170212766;0,0214067278287462;"GO:0032496";"GO:BP";"response to lipopolysaccharide";21092;8790;"Up"
"95";"query_1";TRUE;0,0146324976471233;918;41;10;0,24390243902439;0,0108932461873638;"GO:0014070";"GO:BP";"response to organic cyclic compound";21092;5179;"Up"
"96";"query_1";TRUE;0,0153055952938844;184;32;5;0,15625;0,0271739130434783;"GO:0002221";"GO:BP";"pattern recognition receptor signaling pathway";21092;876;"Up"
"97";"query_1";TRUE;0,0157351104762192;584;50;9;0,18;0,0154109589041096;"GO:0010942";"GO:BP";"positive regulation of cell death";21092;5059;"Up"
"98";"query_1";TRUE;0,0159043964950647;661;56;10;0,178571428571429;0,0151285930408472;"GO:0045859";"GO:BP";"regulation of protein kinase activity";21092;13553;"Up"
"99";"query_1";TRUE;0,0160105138333206;4175;60;27;0,45;0,00646706586826347;"GO:0009889";"GO:BP";"regulation of biosynthetic process";21092;4205;"Up"
"100";"query_1";TRUE;0,0160112064667371;151;39;5;0,128205128205128;0,033112582781457;"GO:0032675";"GO:BP";"regulation of interleukin-6 production";21092;8911;"Up"
"101";"query_1";TRUE;0,0160112064667371;151;39;5;0,128205128205128;0,033112582781457;"GO:0032635";"GO:BP";"interleukin-6 production";21092;8871;"Up"
"102";"query_1";TRUE;0,0160306420439346;29;29;3;0,103448275862069;0,103448275862069;"GO:0055094";"GO:BP";"response to lipoprotein particle";21092;16775;"Up"
"103";"query_1";TRUE;0,0166717238822183;2816;71;24;0,338028169014085;0,00852272727272727;"GO:0007166";"GO:BP";"cell surface receptor signaling pathway";21092;3062;"Up"
"104";"query_1";TRUE;0,0169347313494453;219;47;6;0,127659574468085;0,0273972602739726;"GO:0071219";"GO:BP";"cellular response to molecule of bacterial origin";21092;19229;"Up"
"105";"query_1";TRUE;0,0181188765717286;1488;33;11;0,333333333333333;0,00739247311827957;"GO:0002682";"GO:BP";"regulation of immune system process";21092;1321;"Up"
"106";"query_1";TRUE;0,0191531712647234;360;30;6;0,2;0,0166666666666667;"GO:1901653";"GO:BP";"cellular response to peptide";21092;24916;"Up"
"107";"query_1";TRUE;0,0207019115683361;346;47;7;0,148936170212766;0,0202312138728324;"GO:0002237";"GO:BP";"response to molecule of bacterial origin";21092;891;"Up"
"108";"query_1";TRUE;0,0210967837432379;423;39;7;0,179487179487179;0,016548463356974;"GO:0006979";"GO:BP";"response to oxidative stress";21092;2904;"Up"
"109";"query_1";TRUE;0,0211892065374766;277;39;6;0,153846153846154;0,0216606498194946;"GO:0034599";"GO:BP";"cellular response to oxidative stress";21092;9965;"Up"
"110";"query_1";TRUE;0,0216999913799876;32;29;3;0,103448275862069;0,09375;"GO:0071402";"GO:BP";"cellular response to lipoprotein particle stimulus";21092;19406;"Up"
"111";"query_1";TRUE;0,0230078315216162;3591;62;25;0,403225806451613;0,00696184906711222;"GO:0048513";"GO:BP";"animal organ development";21092;14815;"Up"
"112";"query_1";TRUE;0,0242396133962116;210;52;6;0,115384615384615;0,0285714285714286;"GO:0045637";"GO:BP";"regulation of myeloid cell differentiation";21092;13349;"Up"
"113";"query_1";TRUE;0,0248704920357763;4369;62;28;0,451612903225806;0,0064087891966125;"GO:0048731";"GO:BP";"system development";21092;15011;"Up"
"114";"query_1";TRUE;0,0263925471574366;5993;41;25;0,609756097560976;0,00417153345569831;"GO:0007165";"GO:BP";"signal transduction";21092;3061;"Up"
"115";"query_1";TRUE;0,028465386866037;3775;60;25;0,416666666666667;0,00662251655629139;"GO:0051252";"GO:BP";"regulation of RNA metabolic process";21092;15687;"Up"
"116";"query_1";TRUE;0,0295065423721897;204;33;5;0,151515151515152;0,0245098039215686;"GO:0042594";"GO:BP";"response to starvation";21092;11818;"Up"
"117";"query_1";TRUE;0,0301613330145519;341;34;6;0,176470588235294;0,0175953079178886;"GO:0048545";"GO:BP";"response to steroid hormone";21092;14845;"Up"
"118";"query_1";TRUE;0,030772208359337;92;35;4;0,114285714285714;0,0434782608695652;"GO:0036473";"GO:BP";"cell death in response to oxidative stress";21092;11067;"Up"
"119";"query_1";TRUE;0,0312071688869336;143;23;4;0,173913043478261;0,027972027972028;"GO:0051384";"GO:BP";"response to glucocorticoid";21092;15792;"Up"
"120";"query_1";TRUE;0,0312749999540476;6492;41;26;0,634146341463415;0,00400492914356131;"GO:0023052";"GO:BP";"signaling";21092;7643;"Up"
"121";"query_1";TRUE;0,0326147690402572;2107;35;13;0,371428571428571;0,00616990982439487;"GO:0008219";"GO:BP";"cell death";21092;3556;"Up"
"122";"query_1";TRUE;0,0346268973288019;638;39;8;0,205128205128205;0,0125391849529781;"GO:0071417";"GO:BP";"cellular response to organonitrogen compound";21092;19421;"Up"
"123";"query_1";TRUE;0,0350725363292877;57;58;4;0,0689655172413793;0,0701754385964912;"GO:1900015";"GO:BP";"regulation of cytokine production involved in inflammatory response";21092;23366;"Up"
"124";"query_1";TRUE;0,0350725363292877;57;58;4;0,0689655172413793;0,0701754385964912;"GO:0002534";"GO:BP";"cytokine production involved in inflammatory response";21092;1177;"Up"
"125";"query_1";TRUE;0,0353544329337572;34;32;3;0,09375;0,0882352941176471;"GO:0061081";"GO:BP";"positive regulation of myeloid leukocyte cytokine production involved in immune response";21092;17802;"Up"
"126";"query_1";TRUE;0,0355450757015847;168;69;6;0,0869565217391304;0,0357142857142857;"GO:0006606";"GO:BP";"protein import into nucleus";21092;2574;"Up"
"127";"query_1";TRUE;0,0366367807745854;7494;59;37;0,627118644067797;0,00493728315986122;"GO:0051716";"GO:BP";"cellular response to stimulus";21092;16044;"Up"
"128";"query_1";TRUE;0,0385057466535297;2248;58;18;0,310344827586207;0,00800711743772242;"GO:0031324";"GO:BP";"negative regulation of cellular metabolic process";21092;8250;"Up"
"129";"query_1";TRUE;0,0393176941520743;104;33;4;0,121212121212121;0,0384615384615385;"GO:0042100";"GO:BP";"B cell proliferation";21092;11518;"Up"
"130";"query_1";TRUE;0,0400530875852832;1513;35;11;0,314285714285714;0,00727032385988103;"GO:0051707";"GO:BP";"response to other organism";21092;16036;"Up"
"131";"query_1";TRUE;0,0402397618441011;3849;60;25;0,416666666666667;0,00649519355676799;"GO:0009893";"GO:BP";"positive regulation of metabolic process";21092;4209;"Up"
"132";"query_1";TRUE;0,0406043406749047;172;69;6;0,0869565217391304;0,0348837209302326;"GO:0051170";"GO:BP";"import into nucleus";21092;15619;"Up"
"133";"query_1";TRUE;0,0406298559133554;2968;58;21;0,362068965517241;0,00707547169811321;"GO:0009966";"GO:BP";"regulation of signal transduction";21092;4262;"Up"
"134";"query_1";TRUE;0,0408032015313204;1516;35;11;0,314285714285714;0,00725593667546174;"GO:0043207";"GO:BP";"response to external biotic stimulus";21092;12178;"Up"
"135";"query_1";TRUE;0,04117411522072;904;56;11;0,196428571428571;0,0121681415929204;"GO:0051338";"GO:BP";"regulation of transferase activity";21092;15758;"Up"
"136";"query_1";TRUE;0,0412993230592707;212;34;5;0,147058823529412;0,0235849056603774;"GO:0071383";"GO:BP";"cellular response to steroid hormone stimulus";21092;19387;"Up"
"137";"query_1";TRUE;0,0420973842130424;36;32;3;0,09375;0,0833333333333333;"GO:0010935";"GO:BP";"regulation of macrophage cytokine production";21092;5052;"Up"
"138";"query_1";TRUE;0,0420973842130424;36;32;3;0,09375;0,0833333333333333;"GO:0010934";"GO:BP";"macrophage cytokine production";21092;5051;"Up"
"139";"query_1";TRUE;0,042300549794805;7377;60;37;0,616666666666667;0,00501558899281551;"GO:0019222";"GO:BP";"regulation of metabolic process";21092;6470;"Up"
"140";"query_1";TRUE;0,0462703955865268;224;33;5;0,151515151515152;0,0223214285714286;"GO:0072593";"GO:BP";"reactive oxygen species metabolic process";21092;20323;"Up"
"141";"query_1";TRUE;1,88914799536648e-06;5419;50;32;0,64;0,00590514855139325;"GO:0005829";"GO:CC";"cytosol";21690;468;"Up"
"142";"query_1";TRUE;3,16427945229846e-05;12270;52;47;0,903846153846154;0,00383048084759576;"GO:0005737";"GO:CC";"cytoplasm";21690;383;"Up"
"143";"query_1";TRUE;0,0089602629633621;320;13;4;0,307692307692308;0,0125;"GO:0034774";"GO:CC";"secretory granule lumen";21690;1798;"Up"
"144";"query_1";TRUE;0,00929332480090642;323;13;4;0,307692307692308;0,0123839009287926;"GO:0060205";"GO:CC";"cytoplasmic vesicle lumen";21690;2593;"Up"
"145";"query_1";TRUE;0,00952036922519449;325;13;4;0,307692307692308;0,0123076923076923;"GO:0031983";"GO:CC";"vesicle lumen";21690;1451;"Up"
"146";"query_1";TRUE;0,0311035856514116;91;4;2;0,5;0,021978021978022;"GO:0035578";"GO:CC";"azurophil granule lumen";21690;1856;"Up"
"147";"query_1";TRUE;2,14445643442477e-06;785;58;15;0,258620689655172;0,0191082802547771;"GO:0019900";"GO:MF";"kinase binding";20166;4611;"Up"
"148";"query_1";TRUE;6,04725982465509e-06;2072;35;17;0,485714285714286;0,0082046332046332;"GO:0019899";"GO:MF";"enzyme binding";20166;4610;"Up"
"149";"query_1";TRUE;0,000112366442784242;702;35;10;0,285714285714286;0,0142450142450142;"GO:0019901";"GO:MF";"protein kinase binding";20166;4612;"Up"
"150";"query_1";TRUE;0,00225810193388073;391;35;7;0,2;0,0179028132992327;"GO:0004857";"GO:MF";"enzyme inhibitor activity";20166;1414;"Up"
"151";"query_1";TRUE;0,0138535404828433;33;35;3;0,0857142857142857;0,0909090909090909;"GO:0030291";"GO:MF";"protein serine/threonine kinase inhibitor activity";20166;4789;"Up"
"152";"query_1";TRUE;0,0202907286288087;70;54;4;0,0740740740740741;0,0571428571428571;"GO:0004860";"GO:MF";"protein kinase inhibitor activity";20166;1417;"Up"
"153";"query_1";TRUE;0,0252622729030792;74;54;4;0,0740740740740741;0,0540540540540541;"GO:0019210";"GO:MF";"kinase inhibitor activity";20166;4522;"Up"
"154";"query_1";TRUE;0,0256880459447916;15;14;2;0,142857142857143;0,133333333333333;"GO:0016208";"GO:MF";"AMP binding";20166;3444;"Up"
"155";"query_1";TRUE;0,0275169434686955;14832;56;53;0,946428571428571;0,00357335490830636;"GO:0005515";"GO:MF";"protein binding";20166;1879;"Up"
"156";"query_1";TRUE;0,0126137887999899;321;47;8;0,170212765957447;0,0249221183800623;"HPA:0470203";"HPA";"skin 2; endothelial cells[High]";10976;672;"Up"
"157";"query_1";TRUE;0,00134998699502897;246;39;8;0,205128205128205;0,032520325203252;"KEGG:05131";"KEGG";"Shigellosis";8064;411;"Up"
"158";"query_1";TRUE;0,00403438579525296;142;39;6;0,153846153846154;0,0422535211267606;"KEGG:04936";"KEGG";"Alcoholic liver disease";8064;376;"Up"
"159";"query_1";TRUE;0,00948326309910084;190;12;4;0,333333333333333;0,0210526315789474;"KEGG:04062";"KEGG";"Chemokine signaling pathway";8064;240;"Up"
"160";"query_1";TRUE;0,0122203821231133;205;47;7;0,148936170212766;0,0341463414634146;"KEGG:05205";"KEGG";"Proteoglycans in cancer";8064;440;"Up"
