"";"query";"significant";"p_value";"term_size";"query_size";"intersection_size";"precision";"recall";"term_id";"source";"term_name";"effective_domain_size";"source_order";"set"
"1";"query_1";TRUE;2,12677763880405e-07;36;32;8;0,25;0,222222222222222;"CORUM:193";"CORUM";"PA700-20S-PA28 complex";3627;98;"Up"
"2";"query_1";TRUE;1,86097762934536e-06;14;18;5;0,277777777777778;0,357142857142857;"CORUM:191";"CORUM";"20S proteasome";3627;96;"Up"
"3";"query_1";TRUE;2,78310589809151e-06;15;18;5;0,277777777777778;0,333333333333333;"CORUM:194";"CORUM";"PA28gamma-20S proteasome";3627;99;"Up"
"4";"query_1";TRUE;2,93955516407601e-06;22;26;6;0,230769230769231;0,272727272727273;"CORUM:181";"CORUM";"26S proteasome";3627;92;"Up"
"5";"query_1";TRUE;4,03602783980754e-06;16;18;5;0,277777777777778;0,3125;"CORUM:192";"CORUM";"PA28-20S proteasome";3627;97;"Up"
"6";"query_1";TRUE;9,54605376359201e-09;21;18;5;0,277777777777778;0,238095238095238;"GO:0036388";"GO:BP";"pre-replicative complex assembly";21100;11054;"Up"
"7";"query_1";TRUE;1,5769088736309e-08;23;18;5;0,277777777777778;0,217391304347826;"GO:0002479";"GO:BP";"antigen processing and presentation of exogenous peptide antigen via MHC class I, TAP-dependent";21100;1125;"Up"
"8";"query_1";TRUE;2,08731694825248e-08;326;50;12;0,24;0,0368098159509202;"GO:1903311";"GO:BP";"regulation of mRNA metabolic process";21100;26378;"Up"
"9";"query_1";TRUE;9,39362452259769e-08;32;18;5;0,277777777777778;0,15625;"GO:0042590";"GO:BP";"antigen processing and presentation of exogenous peptide antigen via MHC class I";21100;11831;"Up"
"10";"query_1";TRUE;1,10653679525502e-07;33;18;5;0,277777777777778;0,151515151515152;"GO:0006521";"GO:BP";"regulation of cellular amino acid metabolic process";21100;2494;"Up"
"11";"query_1";TRUE;1,29665227963722e-07;34;18;5;0,277777777777778;0,147058823529412;"GO:0061418";"GO:BP";"regulation of transcription from RNA polymerase II promoter in response to hypoxia";21100;18146;"Up"
"12";"query_1";TRUE;1,71933340968944e-07;181;18;7;0,388888888888889;0,0386740331491713;"GO:0071453";"GO:BP";"cellular response to oxygen levels";21100;19475;"Up"
"13";"query_1";TRUE;2,02811735786008e-07;37;18;5;0,277777777777778;0,135135135135135;"GO:1902036";"GO:BP";"regulation of hematopoietic stem cell differentiation";21100;25293;"Up"
"14";"query_1";TRUE;3,94777932905962e-07;42;18;5;0,277777777777778;0,119047619047619;"GO:1990840";"GO:BP";"response to lectin";21100;29148;"Up"
"15";"query_1";TRUE;3,94777932905962e-07;42;18;5;0,277777777777778;0,119047619047619;"GO:1990858";"GO:BP";"cellular response to lectin";21100;29158;"Up"
"16";"query_1";TRUE;3,94777932905962e-07;42;18;5;0,277777777777778;0,119047619047619;"GO:0002223";"GO:BP";"stimulatory C-type lectin receptor signaling pathway";21100;880;"Up"
"17";"query_1";TRUE;4,46492763482485e-07;43;18;5;0,277777777777778;0,116279069767442;"GO:0031145";"GO:BP";"anaphase-promoting complex-dependent catabolic process";21100;8189;"Up"
"18";"query_1";TRUE;5,66119862651123e-07;45;18;5;0,277777777777778;0,111111111111111;"GO:0038095";"GO:BP";"Fc-epsilon receptor signaling pathway";21100;11179;"Up"
"19";"query_1";TRUE;6,34832346318885e-07;46;18;5;0,277777777777778;0,108695652173913;"GO:0002220";"GO:BP";"innate immune response activating cell surface receptor signaling pathway";21100;877;"Up"
"20";"query_1";TRUE;7,10042408163543e-07;47;18;5;0,277777777777778;0,106382978723404;"GO:0002758";"GO:BP";"innate immune response-activating signal transduction";21100;1393;"Up"
"21";"query_1";TRUE;7,92197993300221e-07;48;18;5;0,277777777777778;0,104166666666667;"GO:0070498";"GO:BP";"interleukin-1-mediated signaling pathway";21100;18899;"Up"
"22";"query_1";TRUE;8,81766923344816e-07;49;18;5;0,277777777777778;0,102040816326531;"GO:0002474";"GO:BP";"antigen processing and presentation of peptide antigen via MHC class I";21100;1120;"Up"
"23";"query_1";TRUE;1,19993874348235e-06;52;18;5;0,277777777777778;0,0961538461538462;"GO:0060218";"GO:BP";"hematopoietic stem cell differentiation";21100;17002;"Up"
"24";"query_1";TRUE;1,60366618924385e-06;55;18;5;0,277777777777778;0,0909090909090909;"GO:0033238";"GO:BP";"regulation of cellular amine metabolic process";21100;9310;"Up"
"25";"query_1";TRUE;1,75998288886334e-06;56;18;5;0,277777777777778;0,0892857142857143;"GO:1901532";"GO:BP";"regulation of hematopoietic progenitor cell differentiation";21100;24822;"Up"
"26";"query_1";TRUE;2,30313907536198e-06;59;18;5;0,277777777777778;0,0847457627118644;"GO:0002478";"GO:BP";"antigen processing and presentation of exogenous peptide antigen";21100;1124;"Up"
"27";"query_1";TRUE;4,05568665229764e-06;186;26;7;0,269230769230769;0,0376344086021505;"GO:0006261";"GO:BP";"DNA-templated DNA replication";21100;2279;"Up"
"28";"query_1";TRUE;5,11250837858623e-06;157;18;6;0,333333333333333;0,0382165605095541;"GO:0071456";"GO:BP";"cellular response to hypoxia";21100;19478;"Up"
"29";"query_1";TRUE;5,14363817118544e-06;69;18;5;0,277777777777778;0,072463768115942;"GO:0043618";"GO:BP";"regulation of transcription from RNA polymerase II promoter in response to stress";21100;12446;"Up"
"30";"query_1";TRUE;5,53645322098028e-06;70;18;5;0,277777777777778;0,0714285714285714;"GO:0043687";"GO:BP";"post-translational protein modification";21100;12482;"Up"
"31";"query_1";TRUE;5,53645322098028e-06;70;18;5;0,277777777777778;0,0714285714285714;"GO:0019884";"GO:BP";"antigen processing and presentation of exogenous antigen";21100;6997;"Up"
"32";"query_1";TRUE;5,95281770253452e-06;71;18;5;0,277777777777778;0,0704225352112676;"GO:0031146";"GO:BP";"SCF-dependent proteasomal ubiquitin-dependent protein catabolic process";21100;8190;"Up"
"33";"query_1";TRUE;6,86036585950624e-06;73;18;5;0,277777777777778;0,0684931506849315;"GO:0060071";"GO:BP";"Wnt signaling pathway, planar cell polarity pathway";21100;16887;"Up"
"34";"query_1";TRUE;6,89439008270793e-06;165;18;6;0,333333333333333;0,0363636363636364;"GO:0036294";"GO:BP";"cellular response to decreased oxygen levels";21100;10996;"Up"
"35";"query_1";TRUE;7,87492015521263e-06;75;18;5;0,277777777777778;0,0666666666666667;"GO:0043620";"GO:BP";"regulation of DNA-templated transcription in response to stress";21100;12448;"Up"
"36";"query_1";TRUE;9,00559968890741e-06;77;18;5;0,277777777777778;0,0649350649350649;"GO:0002218";"GO:BP";"activation of innate immune response";21100;876;"Up"
"37";"query_1";TRUE;9,00559968890741e-06;77;18;5;0,277777777777778;0,0649350649350649;"GO:0090175";"GO:BP";"regulation of establishment of planar polarity";21100;21192;"Up"
"38";"query_1";TRUE;1,02620171421398e-05;79;18;5;0,277777777777778;0,0632911392405063;"GO:0038093";"GO:BP";"Fc receptor signaling pathway";21100;11177;"Up"
"39";"query_1";TRUE;1,16542906926111e-05;81;18;5;0,277777777777778;0,0617283950617284;"GO:0010972";"GO:BP";"negative regulation of G2/M transition of mitotic cell cycle";21100;5089;"Up"
"40";"query_1";TRUE;1,24046765698683e-05;82;18;5;0,277777777777778;0,0609756097560976;"GO:0048002";"GO:BP";"antigen processing and presentation of peptide antigen";21100;14483;"Up"
"41";"query_1";TRUE;1,31930558460238e-05;83;18;5;0,277777777777778;0,0602409638554217;"GO:1902750";"GO:BP";"negative regulation of cell cycle G2/M phase transition";21100;25885;"Up"
"42";"query_1";TRUE;1,31930558460238e-05;83;18;5;0,277777777777778;0,0602409638554217;"GO:2000736";"GO:BP";"regulation of stem cell differentiation";21100;29939;"Up"
"43";"query_1";TRUE;1,3656425699729e-05;339;18;7;0,388888888888889;0,0206489675516224;"GO:0070482";"GO:BP";"response to oxygen levels";21100;18886;"Up"
"44";"query_1";TRUE;1,67552600438654e-05;87;18;5;0,277777777777778;0,0574712643678161;"GO:0035567";"GO:BP";"non-canonical Wnt signaling pathway";21100;10473;"Up"
"45";"query_1";TRUE;2,48013107334592e-05;94;18;5;0,277777777777778;0,0531914893617021;"GO:0001736";"GO:BP";"establishment of planar polarity";21100;523;"Up"
"46";"query_1";TRUE;2,48013107334592e-05;94;18;5;0,277777777777778;0,0531914893617021;"GO:0007164";"GO:BP";"establishment of tissue polarity";21100;3064;"Up"
"47";"query_1";TRUE;2,76588985212899e-05;313;21;7;0,333333333333333;0,0223642172523962;"GO:0006520";"GO:BP";"cellular amino acid metabolic process";21100;2493;"Up"
"48";"query_1";TRUE;7,16520539359902e-05;116;18;5;0,277777777777778;0,0431034482758621;"GO:0001738";"GO:BP";"morphogenesis of a polarized epithelium";21100;525;"Up"
"49";"query_1";TRUE;7,48122563096825e-05;117;18;5;0,277777777777778;0,0427350427350427;"GO:0010389";"GO:BP";"regulation of G2/M transition of mitotic cell cycle";21100;4580;"Up"
"50";"query_1";TRUE;0,000100169322993329;124;18;5;0,277777777777778;0,0403225806451613;"GO:0033209";"GO:BP";"tumor necrosis factor-mediated signaling pathway";21100;9296;"Up"
"51";"query_1";TRUE;0,000100395711050307;940;53;14;0,264150943396226;0,0148936170212766;"GO:0019752";"GO:BP";"carboxylic acid metabolic process";21100;6954;"Up"
"52";"query_1";TRUE;0,000104289294452173;125;18;5;0,277777777777778;0,04;"GO:0090263";"GO:BP";"positive regulation of canonical Wnt signaling pathway";21100;21275;"Up"
"53";"query_1";TRUE;0,000108542825403044;126;18;5;0,277777777777778;0,0396825396825397;"GO:0071347";"GO:BP";"cellular response to interleukin-1";21100;19376;"Up"
"54";"query_1";TRUE;0,000117463324850431;128;18;5;0,277777777777778;0,0390625;"GO:0019882";"GO:BP";"antigen processing and presentation";21100;6995;"Up"
"55";"query_1";TRUE;0,000122136793891928;129;18;5;0,277777777777778;0,0387596899224806;"GO:1902749";"GO:BP";"regulation of cell cycle G2/M phase transition";21100;25884;"Up"
"56";"query_1";TRUE;0,000134479346454933;309;26;7;0,269230769230769;0,0226537216828479;"GO:0006260";"GO:BP";"DNA replication";21100;2278;"Up"
"57";"query_1";TRUE;0,000140787205361561;966;53;14;0,264150943396226;0,0144927536231884;"GO:0043436";"GO:BP";"oxoacid metabolic process";21100;12315;"Up"
"58";"query_1";TRUE;0,000159147143673707;136;18;5;0,277777777777778;0,0367647058823529;"GO:0044106";"GO:BP";"cellular amine metabolic process";21100;12637;"Up"
"59";"query_1";TRUE;0,000176328124001975;188;26;6;0,230769230769231;0,0319148936170213;"GO:0043488";"GO:BP";"regulation of mRNA stability";21100;12363;"Up"
"60";"query_1";TRUE;0,000185911655711347;988;53;14;0,264150943396226;0,01417004048583;"GO:0006082";"GO:BP";"organic acid metabolic process";21100;2114;"Up"
"61";"query_1";TRUE;0,00019065057505948;141;18;5;0,277777777777778;0,0354609929078014;"GO:0009308";"GO:BP";"amine metabolic process";21100;3888;"Up"
"62";"query_1";TRUE;0,000210407699212064;233;22;6;0,272727272727273;0,0257510729613734;"GO:0065004";"GO:BP";"protein-DNA complex assembly";21100;18610;"Up"
"63";"query_1";TRUE;0,000234784763492265;147;18;5;0,277777777777778;0,0340136054421769;"GO:0010565";"GO:BP";"regulation of cellular ketone metabolic process";21100;4716;"Up"
"64";"query_1";TRUE;0,000242868773231509;148;18;5;0,277777777777778;0,0337837837837838;"GO:0038061";"GO:BP";"NIK/NF-kappaB signaling";21100;11164;"Up"
"65";"query_1";TRUE;0,000251172183615843;149;18;5;0,277777777777778;0,0335570469798658;"GO:0050852";"GO:BP";"T cell receptor signaling pathway";21100;15371;"Up"
"66";"query_1";TRUE;0,000252715778349166;302;18;6;0,333333333333333;0,0198675496688742;"GO:0001666";"GO:BP";"response to hypoxia";21100;488;"Up"
"67";"query_1";TRUE;0,000259699359238255;150;18;5;0,277777777777778;0,0333333333333333;"GO:0002244";"GO:BP";"hematopoietic progenitor cell differentiation";21100;900;"Up"
"68";"query_1";TRUE;0,000261953408051763;201;26;6;0,230769230769231;0,0298507462686567;"GO:0043487";"GO:BP";"regulation of RNA stability";21100;12362;"Up"
"69";"query_1";TRUE;0,000268454719816594;151;18;5;0,277777777777778;0,033112582781457;"GO:2000027";"GO:BP";"regulation of animal organ morphogenesis";21100;29252;"Up"
"70";"query_1";TRUE;0,000277740769475046;203;26;6;0,230769230769231;0,0295566502463054;"GO:0061013";"GO:BP";"regulation of mRNA catabolic process";21100;17762;"Up"
"71";"query_1";TRUE;0,000286667952039144;153;18;5;0,277777777777778;0,0326797385620915;"GO:0070555";"GO:BP";"response to interleukin-1";21100;18925;"Up"
"72";"query_1";TRUE;0,000315812881591826;156;18;5;0,277777777777778;0,032051282051282;"GO:0045089";"GO:BP";"positive regulation of innate immune response";21100;13119;"Up"
"73";"query_1";TRUE;0,00032402255602725;315;18;6;0,333333333333333;0,019047619047619;"GO:0036293";"GO:BP";"response to decreased oxygen levels";21100;10995;"Up"
"74";"query_1";TRUE;0,000324288398030717;475;20;7;0,35;0,0147368421052632;"GO:0007346";"GO:BP";"regulation of mitotic cell cycle";21100;3225;"Up"
"75";"query_1";TRUE;0,000347261044031755;159;18;5;0,277777777777778;0,0314465408805031;"GO:0090090";"GO:BP";"negative regulation of canonical Wnt signaling pathway";21100;21113;"Up"
"76";"query_1";TRUE;0,000354144592437522;231;24;6;0,25;0,025974025974026;"GO:0048863";"GO:BP";"stem cell differentiation";21100;15152;"Up"
"77";"query_1";TRUE;0,000358278191772089;160;18;5;0,277777777777778;0,03125;"GO:0030177";"GO:BP";"positive regulation of Wnt signaling pathway";21100;7726;"Up"
"78";"query_1";TRUE;0,000369570815422662;161;18;5;0,277777777777778;0,031055900621118;"GO:0000086";"GO:BP";"G2/M transition of mitotic cell cycle";21100;45;"Up"
"79";"query_1";TRUE;0,000490908007040073;269;22;6;0,272727272727273;0,0223048327137546;"GO:0071824";"GO:BP";"protein-DNA complex subunit organization";21100;19744;"Up"
"80";"query_1";TRUE;0,00057249295837641;347;18;6;0,333333333333333;0,0172910662824208;"GO:0062012";"GO:BP";"regulation of small molecule metabolic process";21100;18502;"Up"
"81";"query_1";TRUE;0,000592015078627806;177;18;5;0,277777777777778;0,0282485875706215;"GO:0044839";"GO:BP";"cell cycle G2/M phase transition";21100;13027;"Up"
"82";"query_1";TRUE;0,000712444972485052;302;21;6;0,285714285714286;0,0198675496688742;"GO:0031349";"GO:BP";"positive regulation of defense response";21100;8280;"Up"
"83";"query_1";TRUE;0,000737243973538935;185;18;5;0,277777777777778;0,027027027027027;"GO:0016579";"GO:BP";"protein deubiquitination";21100;5855;"Up"
"84";"query_1";TRUE;0,000841448889445519;190;18;5;0,277777777777778;0,0263157894736842;"GO:0030178";"GO:BP";"negative regulation of Wnt signaling pathway";21100;7727;"Up"
"85";"query_1";TRUE;0,000863622620795079;191;18;5;0,277777777777778;0,0261780104712042;"GO:1901991";"GO:BP";"negative regulation of mitotic cell cycle phase transition";21100;25249;"Up"
"86";"query_1";TRUE;0,000981535176676612;196;18;5;0,277777777777778;0,0255102040816327;"GO:0002833";"GO:BP";"positive regulation of response to biotic stimulus";21100;1467;"Up"
"87";"query_1";TRUE;0,00119636821880323;204;18;5;0,277777777777778;0,0245098039215686;"GO:0070646";"GO:BP";"protein modification by small protein removal";21100;18982;"Up"
"88";"query_1";TRUE;0,00138939239290073;267;26;6;0,230769230769231;0,0224719101123595;"GO:0006402";"GO:BP";"mRNA catabolic process";21100;2393;"Up"
"89";"query_1";TRUE;0,00183383980235741;4770;52;28;0,538461538461538;0,00587002096436059;"GO:0009059";"GO:BP";"macromolecule biosynthetic process";21100;3662;"Up"
"90";"query_1";TRUE;0,00192004580083233;141;50;6;0,12;0,0425531914893617;"GO:0050684";"GO:BP";"regulation of mRNA processing";21100;15267;"Up"
"91";"query_1";TRUE;0,00197685572590659;5766;52;31;0,596153846153846;0,00537634408602151;"GO:0044260";"GO:BP";"cellular macromolecule metabolic process";21100;12699;"Up"
"92";"query_1";TRUE;0,0022092296867456;231;18;5;0,277777777777778;0,0216450216450216;"GO:0042180";"GO:BP";"cellular ketone metabolic process";21100;11580;"Up"
"93";"query_1";TRUE;0,0023669816237379;444;52;9;0,173076923076923;0,0202702702702703;"GO:0043161";"GO:BP";"proteasome-mediated ubiquitin-dependent protein catabolic process";21100;12179;"Up"
"94";"query_1";TRUE;0,00266643866950136;240;18;5;0,277777777777778;0,0208333333333333;"GO:0045930";"GO:BP";"negative regulation of mitotic cell cycle";21100;13638;"Up"
"95";"query_1";TRUE;0,00277750448865467;242;18;5;0,277777777777778;0,0206611570247934;"GO:0071356";"GO:BP";"cellular response to tumor necrosis factor";21100;19385;"Up"
"96";"query_1";TRUE;0,00295092028333367;245;18;5;0,277777777777778;0,0204081632653061;"GO:0045088";"GO:BP";"regulation of innate immune response";21100;13118;"Up"
"97";"query_1";TRUE;0,00359569448109055;157;50;6;0,12;0,0382165605095541;"GO:0043484";"GO:BP";"regulation of RNA splicing";21100;12359;"Up"
"98";"query_1";TRUE;0,0036334717628357;315;26;6;0,230769230769231;0,019047619047619;"GO:0006401";"GO:BP";"RNA catabolic process";21100;2392;"Up"
"99";"query_1";TRUE;0,00402566028708628;261;18;5;0,277777777777778;0,0191570881226054;"GO:1901988";"GO:BP";"negative regulation of cell cycle phase transition";21100;25246;"Up"
"100";"query_1";TRUE;0,00402566028708628;261;18;5;0,277777777777778;0,0191570881226054;"GO:0050851";"GO:BP";"antigen receptor-mediated signaling pathway";21100;15370;"Up"
"101";"query_1";TRUE;0,00403071139704557;43;45;4;0,0888888888888889;0,0930232558139535;"GO:0006418";"GO:BP";"tRNA aminoacylation for protein translation";21100;2407;"Up"
"102";"query_1";TRUE;0,00410185901963027;262;18;5;0,277777777777778;0,0190839694656489;"GO:0034612";"GO:BP";"response to tumor necrosis factor";21100;9980;"Up"
"103";"query_1";TRUE;0,00418359098454895;695;20;7;0,35;0,0100719424460432;"GO:0010564";"GO:BP";"regulation of cell cycle process";21100;4715;"Up"
"104";"query_1";TRUE;0,00458327710782314;268;18;5;0,277777777777778;0,0186567164179104;"GO:0000209";"GO:BP";"protein polyubiquitination";21100;100;"Up"
"105";"query_1";TRUE;0,00484012069226253;271;18;5;0,277777777777778;0,018450184501845;"GO:0060828";"GO:BP";"regulation of canonical Wnt signaling pathway";21100;17582;"Up"
"106";"query_1";TRUE;0,00549952814358071;1796;21;10;0,476190476190476;0,00556792873051225;"GO:0044281";"GO:BP";"small molecule metabolic process";21100;12712;"Up"
"107";"query_1";TRUE;0,00578949628070942;47;45;4;0,0888888888888889;0,0851063829787234;"GO:0043039";"GO:BP";"tRNA aminoacylation";21100;12098;"Up"
"108";"query_1";TRUE;0,00589916731933366;5700;52;30;0,576923076923077;0,00526315789473684;"GO:0044249";"GO:BP";"cellular biosynthetic process";21100;12692;"Up"
"109";"query_1";TRUE;0,00630600532031198;48;45;4;0,0888888888888889;0,0833333333333333;"GO:0043038";"GO:BP";"amino acid activation";21100;12097;"Up"
"110";"query_1";TRUE;0,00681382449543759;1089;20;8;0,4;0,00734618916437098;"GO:0051726";"GO:BP";"regulation of cell cycle";21100;16066;"Up"
"111";"query_1";TRUE;0,00725030110316675;509;52;9;0,173076923076923;0,0176817288801572;"GO:0010498";"GO:BP";"proteasomal protein catabolic process";21100;4665;"Up"
"112";"query_1";TRUE;0,00751891041984484;453;21;6;0,285714285714286;0,0132450331125828;"GO:0032103";"GO:BP";"positive regulation of response to external stimulus";21100;8541;"Up"
"113";"query_1";TRUE;0,00786711045820891;5774;52;30;0,576923076923077;0,00519570488396259;"GO:1901576";"GO:BP";"organic substance biosynthetic process";21100;24864;"Up"
"114";"query_1";TRUE;0,00855298123491468;2;45;2;0,0444444444444444;1;"GO:0015966";"GO:BP";"diadenosine tetraphosphate biosynthetic process";21100;5609;"Up"
"115";"query_1";TRUE;0,00855298123491468;2;45;2;0,0444444444444444;1;"GO:0015965";"GO:BP";"diadenosine tetraphosphate metabolic process";21100;5608;"Up"
"116";"query_1";TRUE;0,00855298123491468;2;45;2;0,0444444444444444;1;"GO:0015960";"GO:BP";"diadenosine polyphosphate biosynthetic process";21100;5603;"Up"
"117";"query_1";TRUE;0,00862331106280027;305;18;5;0,277777777777778;0,0163934426229508;"GO:0010948";"GO:BP";"negative regulation of cell cycle process";21100;5067;"Up"
"118";"query_1";TRUE;0,00945418048734051;105;50;5;0,1;0,0476190476190476;"GO:0048024";"GO:BP";"regulation of mRNA splicing, via spliceosome";21100;14500;"Up"
"119";"query_1";TRUE;0,00948749493145598;675;52;10;0,192307692307692;0,0148148148148148;"GO:0006511";"GO:BP";"ubiquitin-dependent protein catabolic process";21100;2486;"Up"
"120";"query_1";TRUE;0,00993600281933805;314;18;5;0,277777777777778;0,0159235668789809;"GO:0002757";"GO:BP";"immune response-activating signal transduction";21100;1392;"Up"
"121";"query_1";TRUE;0,00993600281933805;314;18;5;0,277777777777778;0,0159235668789809;"GO:0002429";"GO:BP";"immune response-activating cell surface receptor signaling pathway";21100;1075;"Up"
"122";"query_1";TRUE;0,0108949665453717;320;18;5;0,277777777777778;0,015625;"GO:1901990";"GO:BP";"regulation of mitotic cell cycle phase transition";21100;25248;"Up"
"123";"query_1";TRUE;0,0109398406563269;686;52;10;0,192307692307692;0,0145772594752187;"GO:0019941";"GO:BP";"modification-dependent protein catabolic process";21100;7026;"Up"
"124";"query_1";TRUE;0,0109602105563345;5861;52;30;0,576923076923077;0,00511858044702269;"GO:0009058";"GO:BP";"biosynthetic process";21100;3661;"Up"
"125";"query_1";TRUE;0,0115294179695488;4882;52;27;0,519230769230769;0,00553052027857436;"GO:0044267";"GO:BP";"cellular protein metabolic process";21100;12703;"Up"
"126";"query_1";TRUE;0,0117484081346478;325;18;5;0,277777777777778;0,0153846153846154;"GO:0060070";"GO:BP";"canonical Wnt signaling pathway";21100;16886;"Up"
"127";"query_1";TRUE;0,0125816147602633;697;52;10;0,192307692307692;0,0143472022955524;"GO:0043632";"GO:BP";"modification-dependent macromolecule catabolic process";21100;12455;"Up"
"128";"query_1";TRUE;0,0131627519793187;1130;27;9;0,333333333333333;0,0079646017699115;"GO:0009628";"GO:BP";"response to abiotic stimulus";21100;3996;"Up"
"129";"query_1";TRUE;0,0154819127856867;344;18;5;0,277777777777778;0,0145348837209302;"GO:0002768";"GO:BP";"immune response-regulating cell surface receptor signaling pathway";21100;1403;"Up"
"130";"query_1";TRUE;0,0159234232784885;346;18;5;0,277777777777778;0,0144508670520231;"GO:0030111";"GO:BP";"regulation of Wnt signaling pathway";21100;7708;"Up"
"131";"query_1";TRUE;0,0162427157009652;192;53;6;0,113207547169811;0,03125;"GO:0009060";"GO:BP";"aerobic respiration";21100;3663;"Up"
"132";"query_1";TRUE;0,0203580962961004;364;18;5;0,277777777777778;0,0137362637362637;"GO:0002831";"GO:BP";"regulation of response to biotic stimulus";21100;1465;"Up"
"133";"query_1";TRUE;0,0239810006539749;906;20;7;0,35;0,00772626931567329;"GO:0000278";"GO:BP";"mitotic cell cycle";21100;118;"Up"
"134";"query_1";TRUE;0,0253368063117141;442;26;6;0,230769230769231;0,0135746606334842;"GO:0034655";"GO:BP";"nucleobase-containing compound catabolic process";21100;10007;"Up"
"135";"query_1";TRUE;0,0274417798332586;1023;48;11;0,229166666666667;0,010752688172043;"GO:0006259";"GO:BP";"DNA metabolic process";21100;2277;"Up"
"136";"query_1";TRUE;0,0277158187132682;388;18;5;0,277777777777778;0,0128865979381443;"GO:0045786";"GO:BP";"negative regulation of cell cycle";21100;13512;"Up"
"137";"query_1";TRUE;0,0298354489780547;996;33;9;0,272727272727273;0,00903614457831325;"GO:0030163";"GO:BP";"protein catabolic process";21100;7720;"Up"
"138";"query_1";TRUE;0,0303499207528698;778;32;8;0,25;0,0102827763496144;"GO:0051603";"GO:BP";"proteolysis involved in cellular protein catabolic process";21100;15966;"Up"
"139";"query_1";TRUE;0,0320998963876241;400;18;5;0,277777777777778;0,0125;"GO:0002253";"GO:BP";"activation of immune response";21100;908;"Up"
"140";"query_1";TRUE;0,0328228989772654;1171;51;12;0,235294117647059;0,0102476515798463;"GO:0034645";"GO:BP";"cellular macromolecule biosynthetic process";21100;10001;"Up"
"141";"query_1";TRUE;0,0338545335576068;5487;52;28;0,538461538461538;0,00510297065791872;"GO:0019538";"GO:BP";"protein metabolic process";21100;6769;"Up"
"142";"query_1";TRUE;0,0349933957938131;21;52;3;0,0576923076923077;0,142857142857143;"GO:0042026";"GO:BP";"protein refolding";21100;11493;"Up"
"143";"query_1";TRUE;0,0373697154230963;600;21;6;0,285714285714286;0,01;"GO:0050778";"GO:BP";"positive regulation of immune response";21100;15315;"Up"
"144";"query_1";TRUE;0,0378808592149608;414;18;5;0,277777777777778;0,0120772946859903;"GO:1901987";"GO:BP";"regulation of cell cycle phase transition";21100;25245;"Up"
"145";"query_1";TRUE;0,0408670647087218;481;26;6;0,230769230769231;0,0124740124740125;"GO:0046700";"GO:BP";"heterocycle catabolic process";21100;14305;"Up"
"146";"query_1";TRUE;0,0412403229873733;1312;21;8;0,380952380952381;0,00609756097560976;"GO:0080134";"GO:BP";"regulation of response to stress";21100;20874;"Up"
"147";"query_1";TRUE;0,043823016826558;487;26;6;0,230769230769231;0,0123203285420945;"GO:0044270";"GO:BP";"cellular nitrogen compound catabolic process";21100;12705;"Up"
"148";"query_1";TRUE;0,048776180819391;629;21;6;0,285714285714286;0,0095389507154213;"GO:0031347";"GO:BP";"regulation of defense response";21100;8278;"Up"
"149";"query_1";TRUE;0,0496343513707998;833;32;8;0,25;0,00960384153661465;"GO:0044257";"GO:BP";"cellular protein catabolic process";21100;12697;"Up"
"150";"query_1";TRUE;1,97623368798145e-14;86;51;11;0,215686274509804;0,127906976744186;"GO:1905369";"GO:CC";"endopeptidase complex";21698;4100;"Up"
"151";"query_1";TRUE;6,64962042541955e-13;117;51;11;0,215686274509804;0,094017094017094;"GO:1905368";"GO:CC";"peptidase complex";21698;4099;"Up"
"152";"query_1";TRUE;4,66135012109006e-12;66;48;9;0,1875;0,136363636363636;"GO:0000502";"GO:CC";"proteasome complex";21698;97;"Up"
"153";"query_1";TRUE;1,72277456128639e-09;23;18;5;0,277777777777778;0,217391304347826;"GO:0005839";"GO:CC";"proteasome core complex";21698;478;"Up"
"154";"query_1";TRUE;1,0626983376416e-06;6625;53;37;0,69811320754717;0,00558490566037736;"GO:0070013";"GO:CC";"intracellular organelle lumen";21698;2716;"Up"
"155";"query_1";TRUE;1,06758173899273e-06;6626;53;37;0,69811320754717;0,00558406278297615;"GO:0031974";"GO:CC";"membrane-enclosed lumen";21698;1444;"Up"
"156";"query_1";TRUE;1,06758173899273e-06;6626;53;37;0,69811320754717;0,00558406278297615;"GO:0043233";"GO:CC";"organelle lumen";21698;2130;"Up"
"157";"query_1";TRUE;1,43012429155333e-06;4215;41;25;0,609756097560976;0,00593119810201661;"GO:0005654";"GO:CC";"nucleoplasm";21698;311;"Up"
"158";"query_1";TRUE;1,87885382108955e-06;1505;53;18;0,339622641509434;0,0119601328903654;"GO:1902494";"GO:CC";"catalytic complex";21698;4012;"Up"
